{
  "mode": "macp.mode.decision.v1",
  "initiator": "agent://orchestrator",
  "participants": [
    "agent://orchestrator",
    "agent://a",
    "agent://b"
  ],
  "mode_version": "1.0.0",
  "configuration_version": "cfg-1",
  "policy_version": "",
  "ttl_ms": 60000,
  "messages": [
    {
      "sender": "agent://orchestrator",
      "message_type": "Proposal",
      "payload_type": "macp.modes.decision.v1.ProposalPayload",
      "payload": {
        "proposal_id": "p1",
        "option": "deploy",
        "rationale": "ready",
        "supporting_data": []
      },
      "expect": "accept"
    },
    {
      "_comment": "RFC-MACP-0007 Section 4: Objection is a formal blocking action distinct from a BLOCK Evaluation, with an explicit severity level.",
      "sender": "agent://b",
      "message_type": "Objection",
      "payload_type": "macp.modes.decision.v1.ObjectionPayload",
      "payload": {
        "proposal_id": "p1",
        "reason": "deployment window overlaps a scheduled freeze",
        "severity": "critical"
      },
      "expect": "accept"
    },
    {
      "sender": "agent://a",
      "message_type": "Vote",
      "payload_type": "macp.modes.decision.v1.VotePayload",
      "payload": {
        "proposal_id": "p1",
        "vote": "APPROVE",
        "reason": "good"
      },
      "expect": "accept"
    },
    {
      "sender": "agent://orchestrator",
      "message_type": "Commitment",
      "payload_type": "macp.v1.CommitmentPayload",
      "payload": {
        "commitment_id": "c1",
        "action": "decision.selected",
        "authority_scope": "test",
        "reason": "done",
        "mode_version": "1.0.0",
        "policy_version": "policy.default",
        "configuration_version": "cfg-1",
        "outcome_positive": true
      },
      "expect": "accept"
    }
  ],
  "expected_final_state": "Resolved",
  "expect_resolution_present": true,
  "expected_resolution": {
    "action": "decision.selected",
    "mode_version": "1.0.0",
    "configuration_version": "cfg-1",
    "outcome_positive": true
  },
  "expected_mode_state": {
    "phase": "Committed",
    "proposals": {
      "p1": {
        "proposal_id": "p1",
        "sender": "agent://orchestrator"
      }
    },
    "objections": [
      {
        "proposal_id": "p1",
        "severity": "critical",
        "sender": "agent://b"
      }
    ],
    "votes": {
      "p1": {
        "agent://a": {
          "vote": "APPROVE"
        }
      }
    }
  }
}
